{
  "timestamp": "2026-08-19T16:00:00-04:00",
  "symbol": "CBRS",
  "economic_events": [],
  "earnings": [],
  "ex_dividend": [],
  "opex": [],
  "monthly_opex": [],
  "quarterly_opex": [],
  "index_rebalance": [],
  "fomc": [],
  "cpi": [],
  "nfp": [],
  "treasury_auction": [],
  "market_holiday": [],
  "early_close": []
}
