{
  "timestamp": "2026-08-17T14:40:00-04:00",
  "symbol": "COHR",
  "economic_events": [],
  "earnings": [],
  "ex_dividend": [],
  "opex": [],
  "monthly_opex": [],
  "quarterly_opex": [],
  "index_rebalance": [],
  "fomc": [],
  "cpi": [],
  "nfp": [],
  "treasury_auction": [],
  "market_holiday": [],
  "early_close": []
}
